{
  "$schema": "https://json-schema.org/draft/2020-12/schema",
  "title": "SemQueryBench Evaluation Result Row",
  "description": "Long-format row schema for organizing SemQueryBench baseline prediction and evaluation results.",
  "type": "object",
  "required": [
    "Level",
    "id",
    "db_id",
    "model",
    "method",
    "pred-sql"
  ],
  "properties": {
    "Level": {
      "type": "string",
      "description": "Benchmark difficulty tier.",
      "enum": [
        "easy",
        "medium",
        "mid",
        "hard"
      ]
    },
    "id": {
      "type": [
        "string",
        "integer"
      ],
      "description": "Question/sample identifier."
    },
    "db_id": {
      "type": "string",
      "description": "Database identifier."
    },
    "question": {
      "type": "string",
      "description": "Natural-language question. Optional for public test result files if the benchmark dataset already provides it."
    },
    "Gold-sql": {
      "type": "string",
      "description": "Gold SQL. Required for dev evaluation input; must be omitted from public test result files."
    },
    "model": {
      "type": "string",
      "description": "LLM name, e.g., qwen-72b, qwen-max, DeepSeek-r1, GPT-5.4, CLAUDE-OPUs-4.8."
    },
    "method": {
      "type": "string",
      "description": "Baseline method name.",
      "enum": [
        "MCS",
        "Opensearch",
        "OpenSearch",
        "DAIL-SQL",
        "SDK",
        "AdeptSQL",
        "AdeptSQL-Variant"
      ]
    },
    "pred-sql": {
      "type": "string",
      "description": "Predicted SQL generated by the baseline method."
    },
    "Execute Acc": {
      "type": [
        "integer",
        "number",
        "null"
      ],
      "description": "Execution match / EM label. Use 1 for correct and 0 for incorrect.",
      "enum": [
        0,
        1,
        null
      ]
    },
    "Efficient Acc": {
      "type": [
        "integer",
        "number",
        "null"
      ],
      "description": "EffM label. Use 1 for efficient/correct alternative and 0 for incorrect.",
      "enum": [
        0,
        1,
        null
      ]
    },
    "diff desc": {
      "type": [
        "string",
        "null"
      ],
      "description": "Natural-language description of the main difference between gold SQL and predicted SQL."
    }
  },
  "additionalProperties": true
}